activity_id,activity_name,designation,fullName,name,parkCode,states,url
0C0D142F-06B5-4BE1-8B44-491B90F93DEB,Park Film,National Memorial,Arkansas Post National Memorial,Arkansas Post,arpo,AR,https://www.nps.gov/arpo/index.htm
0C0D142F-06B5-4BE1-8B44-491B90F93DEB,Park Film,National Seashore,Assateague Island National Seashore,Assateague Island,asis,"MD,VA",https://www.nps.gov/asis/index.htm
0C0D142F-06B5-4BE1-8B44-491B90F93DEB,Park Film,National Monument,Aztec Ruins National Monument,Aztec Ruins,azru,NM,https://www.nps.gov/azru/index.htm
0C0D142F-06B5-4BE1-8B44-491B90F93DEB,Park Film,National Park,Badlands National Park,Badlands,badl,SD,https://www.nps.gov/badl/index.htm
0C0D142F-06B5-4BE1-8B44-491B90F93DEB,Park Film,National Monument,Bandelier National Monument,Bandelier,band,NM,https://www.nps.gov/band/index.htm
0C0D142F-06B5-4BE1-8B44-491B90F93DEB,Park Film,National Historic Site,Bent's Old Fort National Historic Site,Bent's Old Fort,beol,CO,https://www.nps.gov/beol/index.htm
0C0D142F-06B5-4BE1-8B44-491B90F93DEB,Park Film,National Park,Big Bend National Park,Big Bend,bibe,TX,https://www.nps.gov/bibe/index.htm
0C0D142F-06B5-4BE1-8B44-491B90F93DEB,Park Film,National Recreation Area,Bighorn Canyon National Recreation Area,Bighorn Canyon,bica,"MT,WY",https://www.nps.gov/bica/index.htm
0C0D142F-06B5-4BE1-8B44-491B90F93DEB,Park Film,National Preserve,Big Cypress National Preserve,Big Cypress,bicy,FL,https://www.nps.gov/bicy/index.htm
0C0D142F-06B5-4BE1-8B44-491B90F93DEB,Park Film,National Battlefield,Big Hole National Battlefield,Big Hole,biho,MT,https://www.nps.gov/biho/index.htm
0C0D142F-06B5-4BE1-8B44-491B90F93DEB,Park Film,National Park,Biscayne National Park,Biscayne,bisc,FL,https://www.nps.gov/bisc/index.htm
0C0D142F-06B5-4BE1-8B44-491B90F93DEB,Park Film,National River & Recreation Area,Big South Fork National River & Recreation Area,Big South Fork,biso,"KY,TN",https://www.nps.gov/biso/index.htm
0C0D142F-06B5-4BE1-8B44-491B90F93DEB,Park Film,National Preserve,Big Thicket National Preserve,Big Thicket,bith,TX,https://www.nps.gov/bith/index.htm
0C0D142F-06B5-4BE1-8B44-491B90F93DEB,Park Film,National Monument,Booker T Washington National Monument,Booker T Washington,bowa,VA,https://www.nps.gov/bowa/index.htm
0C0D142F-06B5-4BE1-8B44-491B90F93DEB,Park Film,National Park,Bryce Canyon National Park,Bryce Canyon,brca,UT,https://www.nps.gov/brca/index.htm
0C0D142F-06B5-4BE1-8B44-491B90F93DEB,Park Film,National Historical Park,Brown v. Board of Education National Historical Park,Brown v. Board of Education,brvb,KS,https://www.nps.gov/brvb/index.htm
0C0D142F-06B5-4BE1-8B44-491B90F93DEB,Park Film,National Monument,Cabrillo National Monument,Cabrillo,cabr,CA,https://www.nps.gov/cabr/index.htm
0C0D142F-06B5-4BE1-8B44-491B90F93DEB,Park Film,National Seashore,Cape Cod National Seashore,Cape Cod,caco,MA,https://www.nps.gov/caco/index.htm
0C0D142F-06B5-4BE1-8B44-491B90F93DEB,Park Film,National Monument,Casa Grande Ruins National Monument,Casa Grande Ruins,cagr,AZ,https://www.nps.gov/cagr/index.htm
0C0D142F-06B5-4BE1-8B44-491B90F93DEB,Park Film,National Seashore,Canaveral National Seashore,Canaveral,cana,FL,https://www.nps.gov/cana/index.htm
0C0D142F-06B5-4BE1-8B44-491B90F93DEB,Park Film,National Monument,Camp Nelson National Monument,Camp Nelson,cane,KY,https://www.nps.gov/cane/index.htm
0C0D142F-06B5-4BE1-8B44-491B90F93DEB,Park Film,National Park,Canyonlands National Park,Canyonlands,cany,UT,https://www.nps.gov/cany/index.htm
0C0D142F-06B5-4BE1-8B44-491B90F93DEB,Park Film,National Park,Capitol Reef National Park,Capitol Reef,care,UT,https://www.nps.gov/care/index.htm
0C0D142F-06B5-4BE1-8B44-491B90F93DEB,Park Film,National Monument,Castillo de San Marcos National Monument,Castillo de San Marcos,casa,FL,https://www.nps.gov/casa/index.htm
0C0D142F-06B5-4BE1-8B44-491B90F93DEB,Park Film,National Park,Carlsbad Caverns National Park,Carlsbad Caverns,cave,NM,https://www.nps.gov/cave/index.htm
0C0D142F-06B5-4BE1-8B44-491B90F93DEB,Park Film,National Historic Site,Carter G. Woodson Home National Historic Site,Carter G. Woodson Home,cawo,DC,https://www.nps.gov/cawo/index.htm
0C0D142F-06B5-4BE1-8B44-491B90F93DEB,Park Film,National Monument,César E. Chávez National Monument,César E. Chávez,cech,CA,https://www.nps.gov/cech/index.htm
0C0D142F-06B5-4BE1-8B44-491B90F93DEB,Park Film,National Memorial,Chamizal National Memorial,Chamizal,cham,TX,https://www.nps.gov/cham/index.htm
0C0D142F-06B5-4BE1-8B44-491B90F93DEB,Park Film,National Military Park,Chickamauga & Chattanooga National Military Park,Chickamauga & Chattanooga,chch,"GA,TN",https://www.nps.gov/chch/index.htm
0C0D142F-06B5-4BE1-8B44-491B90F93DEB,Park Film,National Park,Channel Islands National Park,Channel Islands,chis,CA,https://www.nps.gov/chis/index.htm
0C0D142F-06B5-4BE1-8B44-491B90F93DEB,Park Film,National Historic Site,Charles Pinckney National Historic Site,Charles Pinckney,chpi,SC,https://www.nps.gov/chpi/index.htm
0C0D142F-06B5-4BE1-8B44-491B90F93DEB,Park Film,National Monument,Charles Young Buffalo Soldiers National Monument,Charles Young Buffalo Soldiers,chyo,OH,https://www.nps.gov/chyo/index.htm
0C0D142F-06B5-4BE1-8B44-491B90F93DEB,Park Film,National Monument,Colorado National Monument,Colorado,colm,CO,https://www.nps.gov/colm/index.htm
0C0D142F-06B5-4BE1-8B44-491B90F93DEB,Park Film,National Battlefield,Cowpens National Battlefield,Cowpens,cowp,SC,https://www.nps.gov/cowp/index.htm
0C0D142F-06B5-4BE1-8B44-491B90F93DEB,Park Film,National Park,Crater Lake National Park,Crater Lake,crla,OR,https://www.nps.gov/crla/index.htm
0C0D142F-06B5-4BE1-8B44-491B90F93DEB,Park Film,National Monument & Preserve,Craters Of The Moon National Monument & Preserve,Craters Of The Moon,crmo,ID,https://www.nps.gov/crmo/index.htm
0C0D142F-06B5-4BE1-8B44-491B90F93DEB,Park Film,National Historical Park,Cumberland Gap National Historical Park,Cumberland Gap,cuga,"KY,TN,VA",https://www.nps.gov/cuga/index.htm
0C0D142F-06B5-4BE1-8B44-491B90F93DEB,Park Film,,Civil War Defenses of Washington,Civil War Defenses of Washington,cwdw,"DC,MD,VA",https://www.nps.gov/cwdw/index.htm
0C0D142F-06B5-4BE1-8B44-491B90F93DEB,Park Film,National Historical Park,Dayton Aviation Heritage National Historical Park,Dayton Aviation Heritage,daav,OH,https://www.nps.gov/daav/index.htm
0C0D142F-06B5-4BE1-8B44-491B90F93DEB,Park Film,National Park & Preserve,Denali National Park & Preserve,Denali,dena,AK,https://www.nps.gov/dena/index.htm
0C0D142F-06B5-4BE1-8B44-491B90F93DEB,Park Film,National Park,Death Valley National Park,Death Valley,deva,"CA,NV",https://www.nps.gov/deva/index.htm
0C0D142F-06B5-4BE1-8B44-491B90F93DEB,Park Film,National Monument,Dinosaur National Monument,Dinosaur,dino,"CO,UT",https://www.nps.gov/dino/index.htm
0C0D142F-06B5-4BE1-8B44-491B90F93DEB,Park Film,Part of Statue of Liberty National Monument,Ellis Island Part of Statue of Liberty National Monument,Ellis Island,elis,"NJ,NY",https://www.nps.gov/elis/index.htm
0C0D142F-06B5-4BE1-8B44-491B90F93DEB,Park Film,National Monument,El Malpais National Monument,El Malpais,elma,NM,https://www.nps.gov/elma/index.htm
0C0D142F-06B5-4BE1-8B44-491B90F93DEB,Park Film,National Monument,El Morro National Monument,El Morro,elmo,NM,https://www.nps.gov/elmo/index.htm
0C0D142F-06B5-4BE1-8B44-491B90F93DEB,Park Film,National Park,Everglades National Park,Everglades,ever,FL,https://www.nps.gov/ever/index.htm
0C0D142F-06B5-4BE1-8B44-491B90F93DEB,Park Film,National Historic Site,First Ladies National Historic Site,First Ladies,fila,OH,https://www.nps.gov/fila/index.htm
0C0D142F-06B5-4BE1-8B44-491B90F93DEB,Park Film,National Monument,Florissant Fossil Beds National Monument,Florissant Fossil Beds,flfo,CO,https://www.nps.gov/flfo/index.htm
0C0D142F-06B5-4BE1-8B44-491B90F93DEB,Park Film,National Historic Site,Fort Davis National Historic Site,Fort Davis,foda,TX,https://www.nps.gov/foda/index.htm
0C0D142F-06B5-4BE1-8B44-491B90F93DEB,Park Film,National Battlefield,Fort Donelson National Battlefield,Fort Donelson,fodo,"KY,TN",https://www.nps.gov/fodo/index.htm
0C0D142F-06B5-4BE1-8B44-491B90F93DEB,Park Film,National Historic Site,Fort Larned National Historic Site,Fort Larned,fols,KS,https://www.nps.gov/fols/index.htm
0C0D142F-06B5-4BE1-8B44-491B90F93DEB,Park Film,National Monument and Historic Shrine,Fort McHenry National Monument and Historic Shrine,Fort McHenry,fomc,MD,https://www.nps.gov/fomc/index.htm
0C0D142F-06B5-4BE1-8B44-491B90F93DEB,Park Film,National Battlefield,Fort Necessity National Battlefield,Fort Necessity,fone,PA,https://www.nps.gov/fone/index.htm
0C0D142F-06B5-4BE1-8B44-491B90F93DEB,Park Film,National Historic Site,Fort Point National Historic Site,Fort Point,fopo,CA,https://www.nps.gov/fopo/index.htm
0C0D142F-06B5-4BE1-8B44-491B90F93DEB,Park Film,National Monument,Fort Pulaski National Monument,Fort Pulaski,fopu,GA,https://www.nps.gov/fopu/index.htm
0C0D142F-06B5-4BE1-8B44-491B90F93DEB,Park Film,National Historic Site,Fort Raleigh National Historic Site,Fort Raleigh,fora,NC,https://www.nps.gov/fora/index.htm
0C0D142F-06B5-4BE1-8B44-491B90F93DEB,Park Film,National Historic Site,Fort Scott National Historic Site,Fort Scott,fosc,KS,https://www.nps.gov/fosc/index.htm
0C0D142F-06B5-4BE1-8B44-491B90F93DEB,Park Film,National Historic Site,Fort Smith National Historic Site,Fort Smith,fosm,"AR,OK",https://www.nps.gov/fosm/index.htm
0C0D142F-06B5-4BE1-8B44-491B90F93DEB,Park Film,National Monument,Fort Stanwix National Monument,Fort Stanwix,fost,NY,https://www.nps.gov/fost/index.htm
0C0D142F-06B5-4BE1-8B44-491B90F93DEB,Park Film,National Historical Park,Fort Sumter and Fort Moultrie National Historical Park,Fort Sumter and Fort Moultrie,fosu,SC,https://www.nps.gov/fosu/index.htm
0C0D142F-06B5-4BE1-8B44-491B90F93DEB,Park Film,National Historic Site,Fort Union Trading Post National Historic Site,Fort Union Trading Post,fous,"MT,ND",https://www.nps.gov/fous/index.htm
0C0D142F-06B5-4BE1-8B44-491B90F93DEB,Park Film,National Historic Site,Fort Vancouver National Historic Site,Fort Vancouver,fova,"OR,WA",https://www.nps.gov/fova/index.htm
0C0D142F-06B5-4BE1-8B44-491B90F93DEB,Park Film,National Historic Site,Frederick Douglass National Historic Site,Frederick Douglass,frdo,DC,https://www.nps.gov/frdo/index.htm
0C0D142F-06B5-4BE1-8B44-491B90F93DEB,Park Film,National Historic Site,Friendship Hill National Historic Site,Friendship Hill,frhi,PA,https://www.nps.gov/frhi/index.htm
0C0D142F-06B5-4BE1-8B44-491B90F93DEB,Park Film,National Military Park,Fredericksburg & Spotsylvania National Military Park,Fredericksburg & Spotsylvania,frsp,VA,https://www.nps.gov/frsp/index.htm
0C0D142F-06B5-4BE1-8B44-491B90F93DEB,Park Film,National Memorial,General Grant National Memorial,General Grant,gegr,NY,https://www.nps.gov/gegr/index.htm
0C0D142F-06B5-4BE1-8B44-491B90F93DEB,Park Film,National Historical Park,George Rogers Clark National Historical Park,George Rogers Clark,gero,IN,https://www.nps.gov/gero/index.htm
0C0D142F-06B5-4BE1-8B44-491B90F93DEB,Park Film,National Military Park,Gettysburg National Military Park,Gettysburg,gett,PA,https://www.nps.gov/gett/index.htm
0C0D142F-06B5-4BE1-8B44-491B90F93DEB,Park Film,National Monument,Gila Cliff Dwellings National Monument,Gila Cliff Dwellings,gicl,NM,https://www.nps.gov/gicl/index.htm
0C0D142F-06B5-4BE1-8B44-491B90F93DEB,Park Film,National Park,Glacier National Park,Glacier,glac,MT,https://www.nps.gov/glac/index.htm
0C0D142F-06B5-4BE1-8B44-491B90F93DEB,Park Film,National Park & Preserve,Glacier Bay National Park & Preserve,Glacier Bay,glba,AK,https://www.nps.gov/glba/index.htm
0C0D142F-06B5-4BE1-8B44-491B90F93DEB,Park Film,National Historical Park,Golden Spike National Historical Park,Golden Spike,gosp,UT,https://www.nps.gov/gosp/index.htm
0C0D142F-06B5-4BE1-8B44-491B90F93DEB,Park Film,National Park,Great Basin National Park,Great Basin,grba,NV,https://www.nps.gov/grba/index.htm
0C0D142F-06B5-4BE1-8B44-491B90F93DEB,Park Film,National Park,Grand Canyon National Park,Grand Canyon,grca,AZ,https://www.nps.gov/grca/index.htm
0C0D142F-06B5-4BE1-8B44-491B90F93DEB,Park Film,Park,Great Falls Park,Great Falls,grfa,VA,https://www.nps.gov/grfa/index.htm
0C0D142F-06B5-4BE1-8B44-491B90F93DEB,Park Film,National Monument,Grand Portage National Monument,Grand Portage,grpo,MN,https://www.nps.gov/grpo/index.htm
0C0D142F-06B5-4BE1-8B44-491B90F93DEB,Park Film,National Park & Preserve,Great Sand Dunes National Park & Preserve,Great Sand Dunes,grsa,CO,https://www.nps.gov/grsa/index.htm
0C0D142F-06B5-4BE1-8B44-491B90F93DEB,Park Film,National Park,Great Smoky Mountains National Park,Great Smoky Mountains,grsm,"NC,TN",https://www.nps.gov/grsm/index.htm
0C0D142F-06B5-4BE1-8B44-491B90F93DEB,Park Film,National Military Park,Guilford Courthouse National Military Park,Guilford Courthouse,guco,NC,https://www.nps.gov/guco/index.htm
0C0D142F-06B5-4BE1-8B44-491B90F93DEB,Park Film,National Seashore,Gulf Islands National Seashore,Gulf Islands,guis,"FL,MS",https://www.nps.gov/guis/index.htm
0C0D142F-06B5-4BE1-8B44-491B90F93DEB,Park Film,National Monument,George Washington Carver National Monument,George Washington Carver,gwca,MO,https://www.nps.gov/gwca/index.htm
0C0D142F-06B5-4BE1-8B44-491B90F93DEB,Park Film,National Memorial,Hamilton Grange National Memorial,Hamilton Grange,hagr,NY,https://www.nps.gov/hagr/index.htm
0C0D142F-06B5-4BE1-8B44-491B90F93DEB,Park Film,National Historical Park,Harriet Tubman Underground Railroad National Historical Park,Harriet Tubman Underground Railroad,hatu,MD,https://www.nps.gov/hatu/index.htm
0C0D142F-06B5-4BE1-8B44-491B90F93DEB,Park Film,National Park,Hawaiʻi Volcanoes National Park,Hawaiʻi Volcanoes,havo,HI,https://www.nps.gov/havo/index.htm
0C0D142F-06B5-4BE1-8B44-491B90F93DEB,Park Film,National Historic Site,Herbert Hoover National Historic Site,Herbert Hoover,heho,IA,https://www.nps.gov/heho/index.htm
0C0D142F-06B5-4BE1-8B44-491B90F93DEB,Park Film,National Military Park,Horseshoe Bend National Military Park,Horseshoe Bend,hobe,AL,https://www.nps.gov/hobe/index.htm
0C0D142F-06B5-4BE1-8B44-491B90F93DEB,Park Film,National Historic Site,Hopewell Furnace National Historic Site,Hopewell Furnace,hofu,PA,https://www.nps.gov/hofu/index.htm
0C0D142F-06B5-4BE1-8B44-491B90F93DEB,Park Film,National Historical Park,Homestead National Historical Park,Homestead,home,NE,https://www.nps.gov/home/index.htm
0C0D142F-06B5-4BE1-8B44-491B90F93DEB,Park Film,National Park,Hot Springs National Park,Hot Springs,hosp,AR,https://www.nps.gov/hosp/index.htm
0C0D142F-06B5-4BE1-8B44-491B90F93DEB,Park Film,National Monument,Hovenweep National Monument,Hovenweep,hove,"CO,UT",https://www.nps.gov/hove/index.htm
0C0D142F-06B5-4BE1-8B44-491B90F93DEB,Park Film,National Historic Site,Harry S Truman National Historic Site,Harry S Truman,hstr,MO,https://www.nps.gov/hstr/index.htm
0C0D142F-06B5-4BE1-8B44-491B90F93DEB,Park Film,National Historical Park,Independence National Historical Park,Independence,inde,PA,https://www.nps.gov/inde/index.htm
0C0D142F-06B5-4BE1-8B44-491B90F93DEB,Park Film,National Park,Indiana Dunes National Park,Indiana Dunes,indu,IN,https://www.nps.gov/indu/index.htm
0C0D142F-06B5-4BE1-8B44-491B90F93DEB,Park Film,National Park,Isle Royale National Park,Isle Royale,isro,MI,https://www.nps.gov/isro/index.htm
0C0D142F-06B5-4BE1-8B44-491B90F93DEB,Park Film,National Historic Site,James A Garfield National Historic Site,James A Garfield,jaga,OH,https://www.nps.gov/jaga/index.htm
0C0D142F-06B5-4BE1-8B44-491B90F93DEB,Park Film,National Monument,Jewel Cave National Monument,Jewel Cave,jeca,SD,https://www.nps.gov/jeca/index.htm
0C0D142F-06B5-4BE1-8B44-491B90F93DEB,Park Film,National Park,Gateway Arch National Park,Gateway Arch,jeff,MO,https://www.nps.gov/jeff/index.htm
0C0D142F-06B5-4BE1-8B44-491B90F93DEB,Park Film,National Historical Park and Preserve,Jean Lafitte National Historical Park and Preserve,Jean Lafitte,jela,LA,https://www.nps.gov/jela/index.htm
0C0D142F-06B5-4BE1-8B44-491B90F93DEB,Park Film,National Historical Park,Jimmy Carter National Historical Park,Jimmy Carter,jica,GA,https://www.nps.gov/jica/index.htm
0C0D142F-06B5-4BE1-8B44-491B90F93DEB,Park Film,National Monument,John Day Fossil Beds National Monument,John Day Fossil Beds,joda,OR,https://www.nps.gov/joda/index.htm
0C0D142F-06B5-4BE1-8B44-491B90F93DEB,Park Film,National Historic Site,John Fitzgerald Kennedy National Historic Site,John Fitzgerald Kennedy,jofi,MA,https://www.nps.gov/jofi/index.htm
0C0D142F-06B5-4BE1-8B44-491B90F93DEB,Park Film,National Memorial,Johnstown Flood National Memorial,Johnstown Flood,jofl,PA,https://www.nps.gov/jofl/index.htm
0C0D142F-06B5-4BE1-8B44-491B90F93DEB,Park Film,National Historic Site,John Muir National Historic Site,John Muir,jomu,CA,https://www.nps.gov/jomu/index.htm
0C0D142F-06B5-4BE1-8B44-491B90F93DEB,Park Film,National Historic Trail,Juan Bautista de Anza National Historic Trail,Juan Bautista de Anza,juba,"AZ,CA",https://www.nps.gov/juba/index.htm
0C0D142F-06B5-4BE1-8B44-491B90F93DEB,Park Film,National Historical Park,Kaloko-Honokōhau National Historical Park,Kaloko-Honokōhau,kaho,HI,https://www.nps.gov/kaho/index.htm
0C0D142F-06B5-4BE1-8B44-491B90F93DEB,Park Film,National Park & Preserve,Katmai National Park & Preserve,Katmai,katm,AK,https://www.nps.gov/katm/index.htm
0C0D142F-06B5-4BE1-8B44-491B90F93DEB,Park Film,National Park,Kenai Fjords National Park,Kenai Fjords,kefj,AK,https://www.nps.gov/kefj/index.htm
0C0D142F-06B5-4BE1-8B44-491B90F93DEB,Park Film,National Historical Park,Keweenaw National Historical Park,Keweenaw,kewe,MI,https://www.nps.gov/kewe/index.htm
0C0D142F-06B5-4BE1-8B44-491B90F93DEB,Park Film,National Military Park,Kings Mountain National Military Park,Kings Mountain,kimo,SC,https://www.nps.gov/kimo/index.htm
0C0D142F-06B5-4BE1-8B44-491B90F93DEB,Park Film,National Historical Park,Klondike Gold Rush National Historical Park,Klondike Gold Rush,klgo,AK,https://www.nps.gov/klgo/index.htm
0C0D142F-06B5-4BE1-8B44-491B90F93DEB,Park Film,National Historical Park,Klondike Gold Rush - Seattle Unit National Historical Park,Klondike Gold Rush - Seattle Unit,klse,WA,https://www.nps.gov/klse/index.htm
0C0D142F-06B5-4BE1-8B44-491B90F93DEB,Park Film,National Historic Site,Knife River Indian Villages National Historic Site,Knife River Indian Villages,knri,ND,https://www.nps.gov/knri/index.htm
0C0D142F-06B5-4BE1-8B44-491B90F93DEB,Park Film,National Monument,Lava Beds National Monument,Lava Beds,labe,CA,https://www.nps.gov/labe/index.htm
0C0D142F-06B5-4BE1-8B44-491B90F93DEB,Park Film,National Recreation Area,Lake Mead National Recreation Area,Lake Mead,lake,"AZ,NV",https://www.nps.gov/lake/index.htm
0C0D142F-06B5-4BE1-8B44-491B90F93DEB,Park Film,National Recreation Area,Lake Roosevelt National Recreation Area,Lake Roosevelt,laro,WA,https://www.nps.gov/laro/index.htm
0C0D142F-06B5-4BE1-8B44-491B90F93DEB,Park Film,National Park,Lassen Volcanic National Park,Lassen Volcanic,lavo,CA,https://www.nps.gov/lavo/index.htm
0C0D142F-06B5-4BE1-8B44-491B90F93DEB,Park Film,National Historical Park,Lewis and Clark National Historical Park,Lewis and Clark,lewi,"OR,WA",https://www.nps.gov/lewi/index.htm
0C0D142F-06B5-4BE1-8B44-491B90F93DEB,Park Film,National Memorial,Lincoln Boyhood National Memorial,Lincoln Boyhood,libo,IN,https://www.nps.gov/libo/index.htm
0C0D142F-06B5-4BE1-8B44-491B90F93DEB,Park Film,National Historic Site,Lincoln Home National Historic Site,Lincoln Home,liho,IL,https://www.nps.gov/liho/index.htm
0C0D142F-06B5-4BE1-8B44-491B90F93DEB,Park Film,National Historical Park,Lowell National Historical Park,Lowell,lowe,MA,https://www.nps.gov/lowe/index.htm
0C0D142F-06B5-4BE1-8B44-491B90F93DEB,Park Film,National Historical Park,Lyndon B Johnson National Historical Park,Lyndon B Johnson,lyjo,TX,https://www.nps.gov/lyjo/index.htm
0C0D142F-06B5-4BE1-8B44-491B90F93DEB,Park Film,National Historical Park,Marsh - Billings - Rockefeller National Historical Park,Marsh - Billings - Rockefeller,mabi,VT,https://www.nps.gov/mabi/index.htm
0C0D142F-06B5-4BE1-8B44-491B90F93DEB,Park Film,National Park,Mammoth Cave National Park,Mammoth Cave,maca,KY,https://www.nps.gov/maca/index.htm
0C0D142F-06B5-4BE1-8B44-491B90F93DEB,Park Film,"National Historic Site
",Mary McLeod Bethune Council House National Historic Site,Mary McLeod Bethune Council House,mamc,DC,https://www.nps.gov/mamc/index.htm
0C0D142F-06B5-4BE1-8B44-491B90F93DEB,Park Film,National Battlefield Park,Manassas National Battlefield Park,Manassas,mana,VA,https://www.nps.gov/mana/index.htm
0C0D142F-06B5-4BE1-8B44-491B90F93DEB,Park Film,National Historic Site,Manzanar National Historic Site,Manzanar,manz,CA,https://www.nps.gov/manz/index.htm
0C0D142F-06B5-4BE1-8B44-491B90F93DEB,Park Film,National Historical Park,Manhattan Project National Historical Park,Manhattan Project,mapr,"NM,WA,TN",https://www.nps.gov/mapr/index.htm
0C0D142F-06B5-4BE1-8B44-491B90F93DEB,Park Film,National Historic Site,Martin Van Buren National Historic Site,Martin Van Buren,mava,NY,https://www.nps.gov/mava/index.htm
0C0D142F-06B5-4BE1-8B44-491B90F93DEB,Park Film,National Park,Mesa Verde National Park,Mesa Verde,meve,CO,https://www.nps.gov/meve/index.htm
0C0D142F-06B5-4BE1-8B44-491B90F93DEB,Park Film,National Historic Site,Minuteman Missile National Historic Site,Minuteman Missile,mimi,SD,https://www.nps.gov/mimi/index.htm
0C0D142F-06B5-4BE1-8B44-491B90F93DEB,Park Film,National Monument,Mill Springs Battlefield National Monument,Mill Springs Battlefield,misp,KY,https://www.nps.gov/misp/index.htm
0C0D142F-06B5-4BE1-8B44-491B90F93DEB,Park Film,National Recreational River,Missouri National Recreational River,Missouri,mnrr,"SD,NE",https://www.nps.gov/mnrr/index.htm
0C0D142F-06B5-4BE1-8B44-491B90F93DEB,Park Film,National Battlefield,Moores Creek National Battlefield,Moores Creek,mocr,NC,https://www.nps.gov/mocr/index.htm
0C0D142F-06B5-4BE1-8B44-491B90F93DEB,Park Film,National Preserve,Mojave National Preserve,Mojave,moja,CA,https://www.nps.gov/moja/index.htm
0C0D142F-06B5-4BE1-8B44-491B90F93DEB,Park Film,National Park,Mount Rainier National Park,Mount Rainier,mora,WA,https://www.nps.gov/mora/index.htm
0C0D142F-06B5-4BE1-8B44-491B90F93DEB,Park Film,National Historical Park,Morristown National Historical Park,Morristown,morr,NJ,https://www.nps.gov/morr/index.htm
0C0D142F-06B5-4BE1-8B44-491B90F93DEB,Park Film,National Memorial,Mount Rushmore National Memorial,Mount Rushmore,moru,SD,https://www.nps.gov/moru/index.htm
0C0D142F-06B5-4BE1-8B44-491B90F93DEB,Park Film,National Monument,Natural Bridges National Monument,Natural Bridges,nabr,UT,https://www.nps.gov/nabr/index.htm
0C0D142F-06B5-4BE1-8B44-491B90F93DEB,Park Film,Parkway,Natchez Trace Parkway,Natchez Trace,natr,"AL,MS,TN",https://www.nps.gov/natr/index.htm
0C0D142F-06B5-4BE1-8B44-491B90F93DEB,Park Film,National Historical Park,Nez Perce National Historical Park,Nez Perce,nepe,"ID,MT,OR,WA",https://www.nps.gov/nepe/index.htm
0C0D142F-06B5-4BE1-8B44-491B90F93DEB,Park Film,National Park & Preserve,New River Gorge National Park & Preserve,New River Gorge,neri,WV,https://www.nps.gov/neri/index.htm
0C0D142F-06B5-4BE1-8B44-491B90F93DEB,Park Film,National Scenic River,Niobrara National Scenic River,Niobrara,niob,NE,https://www.nps.gov/niob/index.htm
0C0D142F-06B5-4BE1-8B44-491B90F93DEB,Park Film,National Historic Site,Ninety Six National Historic Site,Ninety Six,nisi,SC,https://www.nps.gov/nisi/index.htm
0C0D142F-06B5-4BE1-8B44-491B90F93DEB,Park Film,,National Parks of New York Harbor,National Parks of New York Harbor,npnh,NY,https://www.nps.gov/npnh/index.htm
0C0D142F-06B5-4BE1-8B44-491B90F93DEB,Park Film,Wild & Scenic River,Obed Wild & Scenic River,Obed,obed,TN,https://www.nps.gov/obed/index.htm
0C0D142F-06B5-4BE1-8B44-491B90F93DEB,Park Film,National Historical Park,Ocmulgee Mounds National Historical Park,Ocmulgee Mounds,ocmu,GA,https://www.nps.gov/ocmu/index.htm
0C0D142F-06B5-4BE1-8B44-491B90F93DEB,Park Film,National Park,Olympic National Park,Olympic,olym,WA,https://www.nps.gov/olym/index.htm
0C0D142F-06B5-4BE1-8B44-491B90F93DEB,Park Film,National Monument,Organ Pipe Cactus National Monument,Organ Pipe Cactus,orpi,AZ,https://www.nps.gov/orpi/index.htm
0C0D142F-06B5-4BE1-8B44-491B90F93DEB,Park Film,National Historic Trail,Overmountain Victory National Historic Trail,Overmountain Victory,ovvi,"NC,SC,TN,VA",https://www.nps.gov/ovvi/index.htm
0C0D142F-06B5-4BE1-8B44-491B90F93DEB,Park Film,National Scenic Riverways,Ozark National Scenic Riverways,Ozark,ozar,MO,https://www.nps.gov/ozar/index.htm
0C0D142F-06B5-4BE1-8B44-491B90F93DEB,Park Film,National Historical Park,Palo Alto Battlefield National Historical Park,Palo Alto Battlefield,paal,TX,https://www.nps.gov/paal/index.htm
0C0D142F-06B5-4BE1-8B44-491B90F93DEB,Park Film,National Seashore,Padre Island National Seashore,Padre Island,pais,TX,https://www.nps.gov/pais/index.htm
0C0D142F-06B5-4BE1-8B44-491B90F93DEB,Park Film,National Park,Petrified Forest National Park,Petrified Forest,pefo,AZ,https://www.nps.gov/pefo/index.htm
0C0D142F-06B5-4BE1-8B44-491B90F93DEB,Park Film,National Military Park,Pea Ridge National Military Park,Pea Ridge,peri,AR,https://www.nps.gov/peri/index.htm
0C0D142F-06B5-4BE1-8B44-491B90F93DEB,Park Film,National Monument,Petroglyph National Monument,Petroglyph,petr,NM,https://www.nps.gov/petr/index.htm
0C0D142F-06B5-4BE1-8B44-491B90F93DEB,Park Film,Memorial,Perry's Victory & International Peace Memorial,Perry's Victory & International Peace,pevi,OH,https://www.nps.gov/pevi/index.htm
0C0D142F-06B5-4BE1-8B44-491B90F93DEB,Park Film,National Park,Pinnacles National Park,Pinnacles,pinn,CA,https://www.nps.gov/pinn/index.htm
0C0D142F-06B5-4BE1-8B44-491B90F93DEB,Park Film,National Monument,Pipestone National Monument,Pipestone,pipe,MN,https://www.nps.gov/pipe/index.htm
